Id,CouncilPeriod,ShortTitle,Introducer,LegislationNumber,LawNumber,ActNumber,IntroductionDate,Modified,CommitteeReferral,CommitteeReferralComments,Deemed,DeemedOn,LegislationStatus,Category,Subcategory,DocumentUrl
43085,23,Correspondence from the DC PCSB - SY 2018-19 Attendance and Discipline Report,Chairman Phil Mendelson,RC23-0095,,,2019-08-14,2019-08-15,,,,,New,Report,Other,http://lims.dccouncil.us/Download/43085/RC23-0095-Introduction.pdf
43084,23,Correspondence from the CCRC - FY 2019 Third Quarter Report,Chairman Phil Mendelson,RC23-0094,,,2019-08-14,2019-08-14,,,,,New,Report,Other,http://lims.dccouncil.us/Download/43084/RC23-0094-Introduction.pdf
43083,23,Correspondence from the DC PCSB - 2019 Annual Report,Chairman Phil Mendelson,RC23-0093,,,2019-08-14,2019-08-14,,,,,New,Report,Other,http://lims.dccouncil.us/Download/43083/RC23-0093-Introduction.pdf
43082,23,Correspondence from the Mayor - DOES Semi-Annual Compliance Report (July - December 2018),Chairman Phil Mendelson,RC23-0092,,,2019-08-13,2019-08-13,,,,,New,Report,Other,http://lims.dccouncil.us/Download/43082/RC23-0092-Introduction.pdf
43078,23,"Correspondence from the Mayor - DOEE Annual Report, CY18 eCYCLE DC: Electronics Product Stewardship Program Report ",Chairman Phil Mendelson,RC23-0091,,,2019-08-06,2019-08-06,,,,,Under Council Review,Report,Other,http://lims.dccouncil.us/Download/43078/RC23-0091-Introduction.pdf
