Introducer,DeemedOn,IntroductionDate,LawNumber,ActNumber,DocumentUrl,LegislationNumber,Deemed,ShortTitle,LegislationStatus,Subcategory,CouncilPeriod,Id,CommitteeReferralComments,Category,Modified,CommitteeReferral
"Councilmembers Allen, Grosso, Todd, Cheh, Gray, and Nadeau",,2020-03-19,,,http://lims.dccouncil.us/Download/44484/B23-0723-Introduction.pdf,B23-0723,,Rioting Modernization Amendment Act of 2020,New,Permanent Bill,23,44484,,Bill,2020-03-20,Committee on Judiciary and Public Safety
Chairman Mendelson,2020-04-30,2020-03-17,,,http://lims.dccouncil.us/Download/44467/CA23-0465-Introduction.pdf,CA23-0465,Disapproved,"Proposed contract with Fidelity Information Services, LLC ",New,Contract,23,44467,,Contract,2020-03-20,Retained by the Council
Chairman Mendelson,,2020-03-19,,,http://lims.dccouncil.us/Download/44483/PR23-0774-Introduction.pdf,PR23-0774,,"Contract No. CFOPD-20-C-014, Electronic Benefit Transfer (EBT) Services Approval Resolution of 2020",New,Proposed Resolution,23,44483,,Resolution,2020-03-20,Retained by the Council
Councilmember Nadeau,,2020-03-17,,,http://lims.dccouncil.us/Download/44472/B23-0720-Introduction.pdf,B23-0720,,Adams Morgan Business Improvement District Amendment Emergency Amendment Act of 2020,New,Emergency Bill,23,44472,,Bill,2020-03-20,Retained by the Council
Chairman Mendelson,2020-03-30,2020-03-19,,,http://lims.dccouncil.us/Download/44478/CA23-0468-Introduction.pdf,CA23-0468,Approved,"Proposed contract with Avid Systems, LLC",New,Contract,23,44478,,Contract,2020-03-20,Retained by the Council
Councilmember T. White and Chairman Mendelson,,2020-03-12,,,http://lims.dccouncil.us/Download/44448/B23-0713-Introduction.pdf,B23-0713,,Ward 8 Senior Housing Fund Establishment Emergency Amendment Act of 2020,Under Mayoral Review,Emergency Bill,23,44448,,Bill,2020-03-20,Retained by the Council
Councilmember Bonds,,2020-03-03,,,http://lims.dccouncil.us/Download/44315/B23-0689-Introduction.pdf,B23-0689,,Reverse Mortgage Insurance and Tax Payment Program Temporary Amendment Act of 2020,Under Mayoral Review,Temporary Bill,23,44315,,Bill,2020-03-20,Retained by the Council
Councilmembers Allen and Nadeau,,2020-03-02,,,http://lims.dccouncil.us/Download/44310/B23-0686-Introduction.pdf,B23-0686,,Extreme Risk Protection Order Implementation Working Group Temporary Amendment Act of 2020,Under Mayoral Review,Temporary Bill,23,44310,,Bill,2020-03-20,Retained by the Council
"Councilmembers T. White, McDuffie, Cheh, and Bonds",,2020-03-03,,,http://lims.dccouncil.us/Download/44339/B23-0702-Introduction.pdf,B23-0702,,Ensuring the Public Trust in Human Services Through Customer Satisfaction Survey Act of 2020,Under Council Review,Permanent Bill,23,44339,,Bill,2020-03-20,Committee on Human Services
Councilmembers Allen and Cheh,,2020-03-02,,,http://lims.dccouncil.us/Download/44302/B23-0684-Introduction.pdf,B23-0684,,Leave to Vote Temporary Amendment Act of 2020,Under Mayoral Review,Temporary Bill,23,44302,,Bill,2020-03-20,Retained by the Council
Chairman Mendelson,,2020-02-28,,,http://lims.dccouncil.us/Download/44299/B23-0682-Introduction.pdf,B23-0682,,Ghost Guns Prohibition Temporary Amendment Act of 2020,Under Mayoral Review,Temporary Bill,23,44299,,Bill,2020-03-20,Retained by the Council
Councilmembers Gray and Bonds,,2020-03-03,,,http://lims.dccouncil.us/Download/44338/B23-0701-Introduction.pdf,B23-0701,,Birth-to-Three for All D.C. and Metro for D.C. Dedicated Funding Amendment Act of 2020,Under Council Review,Permanent Bill,23,44338,,Bill,2020-03-20,Committee of the Whole
Chairman Mendelson,,2020-02-27,,,http://lims.dccouncil.us/Download/44293/B23-0678-Introduction.pdf,B23-0678,,Contract No. DCCB-2019-C-0015 with Milberg Phillips Grossman LLP and Evangelista Worley LLC Approval and Payment Authorization Emergency Act of 2020,Under Mayoral Review,Emergency Bill,23,44293,,Bill,2020-03-20,Retained by the Council
Chairman Mendelson,,2020-02-27,,,http://lims.dccouncil.us/Download/44254/B23-0674-Introduction.pdf,B23-0674,,Substantive Technical Temporary Amendment Act of 2020,Under Mayoral Review,Temporary Bill,23,44254,,Bill,2020-03-20,Retained by the Council
"Councilmembers R. White, Nadeau, Cheh, and Silverman",,2020-03-03,,,http://lims.dccouncil.us/Download/44337/B23-0700-Introduction.pdf,B23-0700,,Reporting Sexual Misconduct in Schools Amendment Act of 2020,Under Council Review,Permanent Bill,23,44337,,Bill,2020-03-20,Committee on Education and Committee of the Whole
"Councilmembers Todd, Nadeau, Cheh, T. White, Allen, Grosso, Bonds, and Chairman Mendelson",,2020-03-03,,,http://lims.dccouncil.us/Download/44336/B23-0699-Introduction.pdf,B23-0699,,End Gun Violence Motor Vehicle Identification Tags Amendment Act of 2020,Under Council Review,Permanent Bill,23,44336,,Bill,2020-03-20,Committee on Transportation and the Environment
"Councilmembers Allen, Cheh, Nadeau, T. White, Bonds, McDuffie, R. White, Grosso, Todd, and Chairman Mendelson",,2020-03-03,,,http://lims.dccouncil.us/Download/44335/B23-0698-Introduction.pdf,B23-0698,,Metro for D.C. Amendment Act of 2020,Under Council Review,Permanent Bill,23,44335,,Bill,2020-03-20,Committee on Transportation and the Environment and Committee of the Whole
"Councilmembers Grosso, Nadeau, R. White, Bonds, Cheh, and Silverman",,2020-03-03,,,http://lims.dccouncil.us/Download/44334/B23-0697-Introduction.pdf,B23-0697,,Student Loan Borrower Bill of Rights Amendment Act of 2020,Under Council Review,Permanent Bill,23,44334,,Bill,2020-03-20,Committee on Business and Economic Development
"Councilmembers Bonds, Todd, Nadeau, Cheh, Grosso, and T. White",,2020-03-03,,,http://lims.dccouncil.us/Download/44333/B23-0696-Introduction.pdf,B23-0696,,Limited Equity Cooperative Advisory Council Act of 2020,Under Council Review,Permanent Bill,23,44333,,Bill,2020-03-20,Committee on Housing and Neighborhood Revitalization
Chairman Mendelson,2020-03-30,2020-03-19,,,http://lims.dccouncil.us/Download/44482/CA23-0472-Introduction.pdf,CA23-0472,Approved,Proposed loan agreement between the Department of Housing and Community Development (DHCD) and Scattered Sites III LLC ,New,Contract,23,44482,,Contract,2020-03-20,Retained by the Council
"Councilmembers Bonds, Todd, Nadeau, T. White, Cheh, Grosso, and R. White",,2020-03-03,,,http://lims.dccouncil.us/Download/44332/B23-0695-Introduction.pdf,B23-0695,,Limited Equity Cooperative Property Tax Assistance Amendment Act of 2020,Under Council Review,Permanent Bill,23,44332,,Bill,2020-03-20,Committee on Business and Economic Development
"Councilmembers Bonds, Grosso, R. White, Cheh, and Nadeau",,2020-03-03,,,http://lims.dccouncil.us/Download/44331/B23-0694-Introduction.pdf,B23-0694,,TOPA Reporting Amendment Act of 2020,Under Council Review,Permanent Bill,23,44331,,Bill,2020-03-20,Committee on Housing and Neighborhood Revitalization
"Councilmembers Cheh, Bonds, Nadeau, and Grosso",,2020-03-03,,,http://lims.dccouncil.us/Download/44330/B23-0693-Introduction.pdf,B23-0693,,Lottery Winner Protection Amendment Act of 2020,Under Council Review,Permanent Bill,23,44330,,Bill,2020-03-20,Committee on Business and Economic Development
Councilmember Todd,,2020-03-03,,,http://lims.dccouncil.us/Download/44325/B23-0692-Introduction.pdf,B23-0692,,ROSA Loophole Elimination Amendment Act of 2020,Under Council Review,Permanent Bill,23,44325,,Bill,2020-03-20,Committee on Transportation and the Environment
Councilmember Todd,,2020-03-02,,,http://lims.dccouncil.us/Download/44322/B23-0690-Introduction.pdf,B23-0690,,SMA Screening Act of 2020,Under Council Review,Permanent Bill,23,44322,,Bill,2020-03-20,Committee on Health
Chairman Mendelson,2020-03-30,2020-03-19,,,http://lims.dccouncil.us/Download/44481/CA23-0471-Introduction.pdf,CA23-0471,Approved,"Proposed contract with Sky, LLC dba U.S. Office Solutions ",New,Contract,23,44481,,Contract,2020-03-20,Retained by the Council
Councilmembers Allen and Nadeau,,2020-02-27,,,http://lims.dccouncil.us/Download/44296/B23-0680-Introduction.pdf,B23-0680,,Cecelia's Way Designation Act of 2020,Under Council Review,Permanent Bill,23,44296,,Bill,2020-03-20,Committee of the Whole
Councilmember Allen,,2020-03-09,,,http://lims.dccouncil.us/Download/44429/B23-0708-Introduction.pdf,B23-0708,,"The D.C. Central Kitchen, Inc. Tax Rebate Act of 2020",Under Council Review,Permanent Bill,23,44429,,Bill,2020-03-20,Committee on Business and Economic Development
Chairman Mendelson,2020-03-30,2020-03-19,,,http://lims.dccouncil.us/Download/44480/CA23-0470-Introduction.pdf,CA23-0470,Approved,Proposed all-risk property insurance binder with Zurich North America Insurance Company ,New,Contract,23,44480,,Contract,2020-03-20,Retained by the Council
Chairman Mendelson and Councilmember Grosso,,2020-03-16,,,http://lims.dccouncil.us/Download/44465/B23-0717-Introduction.pdf,B23-0717,,Expanding Equitable Access to Great Schools Act of 2020,New,Permanent Bill,23,44465,,Bill,2020-03-20,Committee on Education and Committee of the Whole
Chairman Mendelson,2020-03-30,2020-03-19,,,http://lims.dccouncil.us/Download/44479/CA23-0469-Introduction.pdf,CA23-0469,Approved,"Proposed contract to exercise option year one (1) with Capital Consulting, LLC dba Tharseo IT ",New,Contract,23,44479,,Contract,2020-03-20,Retained by the Council
Chairman Mendelson,2020-03-30,2020-03-19,,,http://lims.dccouncil.us/Download/44477/CA23-0467-Introduction.pdf,CA23-0467,Approved,"Proposed contract modification to exercise option year three (3) with KPMG, LLP ",New,Contract,23,44477,,Contract,2020-03-20,Retained by the Council
Chairman Mendelson,2020-03-30,2020-03-19,,,http://lims.dccouncil.us/Download/44476/CA23-0466-Introduction.pdf,CA23-0466,Approved,"Proposed contract modification to exercise option year one (1) with DigiDoc, Inc. ",New,Contract,23,44476,,Contract,2020-03-20,Retained by the Council
Chairman Mendelson at the request of the Mayor,,2020-03-18,,,http://lims.dccouncil.us/Download/44475/RC23-0169-Introduction.pdf,RC23-0169,,Correspondence from the Mayor - Workforce Innovation and Opportunity Act (WIOA) Unified State Plan July 2020 - June 2024,New,Other,23,44475,,Report,2020-03-20,
Chairman Mendelson,,2020-02-27,,R23-0385,http://lims.dccouncil.us/Download/44292/PR23-0742-Introduction.pdf,PR23-0742,,Contract No. DCCB-2019-C-0015 with Milberg Phillips Grossman LLP and Evangelista Worley LLC Approval and Payment Authorization Emergency Declaration Resolution of 2020,Approved,Emergency Declaration Resolution,23,44292,,Resolution,2020-03-19,Retained by the Council
Councilmember T. White and Chairman Mendelson,,2020-03-12,,R23-0384,http://lims.dccouncil.us/Download/44447/PR23-0768-Introduction.pdf,PR23-0768,,Ward 8 Senior Housing Fund Establishment Emergency Declaration Resolution of 2020,Approved,Emergency Declaration Resolution,23,44447,,Resolution,2020-03-19,Retained by the Council
Councilmember Nadeau,,2020-03-17,,R23-0383,http://lims.dccouncil.us/Download/44471/PR23-0773-Introduction.pdf,PR23-0773,,Adams Morgan Business Improvement District Amendment Emergency Declaration Resolution of 2020,Approved,Emergency Declaration Resolution,23,44471,,Resolution,2020-03-19,Retained by the Council
"Chairman Mendelson and Councilmembers Grosso, R. White, Cheh, Allen, T. White, McDuffie, Bonds, Silverman, Nadeau, Todd, and Gray",,2020-03-17,,A23-0247,http://lims.dccouncil.us/Download/44469/B23-0718-Introduction.pdf,B23-0718,,COVID-19 Response Emergency Amendment Act of 2020,New,Emergency Bill,23,44469,,Bill,2020-03-18,Retained by the Council
Chairman Mendelson,,2020-02-26,,A23-0249,http://lims.dccouncil.us/Download/44289/B23-0676-Introduction.pdf,B23-0676,,"Contract No. NFPHCSUPP-20-C-1 Modifications between the Not-for-Profit Hospital Corporation and Morrison Management Specialist, Inc. Approval and Payment Authorization Emergency Amendment Act of 2020",Enacted,Emergency Bill,23,44289,,Bill,2020-03-18,Retained by the Council
Chairman Mendelson,,2020-02-27,,A23-0250,http://lims.dccouncil.us/Download/44295/B23-0679-Introduction.pdf,B23-0679,,Reunion Square Tax Increment Financing Emergency Act of 2019,Enacted,Emergency Bill,23,44295,,Bill,2020-03-18,Retained by the Council
Councilmembers Allen and Cheh,,2020-03-02,,A23-0251,http://lims.dccouncil.us/Download/44301/B23-0683-Introduction.pdf,B23-0683,,Leave to Vote Emergency Amendment Act of 2020,Enacted,Emergency Bill,23,44301,,Bill,2020-03-18,Retained by the Council
Councilmembers Allen and Nadeau,,2020-03-02,,A23-0252,http://lims.dccouncil.us/Download/44309/B23-0685-Introduction.pdf,B23-0685,,Extreme Risk Protection Order Implementation Working Group Emergency Amendment Act of 2020,Enacted,Emergency Bill,23,44309,,Bill,2020-03-18,Retained by the Council
Councilmember Bonds,,2020-03-03,,A23-0253,http://lims.dccouncil.us/Download/44314/B23-0688-Introduction.pdf,B23-0688,,Reverse Mortgage Insurance and Tax Payment Program Emergency Amendment Act of 2020,Enacted,Emergency Bill,23,44314,,Bill,2020-03-18,Retained by the Council
Chairman Mendelson,2020-03-12,2020-02-28,,,http://lims.dccouncil.us/Download/44307/CA23-0446-Introduction.pdf,CA23-0446,Approved,"Proposed contract with Don Brown Bus Sales, Inc. ",Deemed Approved,Contract,23,44307,,Contract,2020-03-18,Retained by the Council
Chairman Mendelson,2020-03-12,2020-02-28,,,http://lims.dccouncil.us/Download/44306/CA23-0445-Introduction.pdf,CA23-0445,Approved,Proposed contract with General Services Administration (GSA) ,Deemed Approved,Contract,23,44306,,Contract,2020-03-18,Retained by the Council
Chairman Mendelson,2020-03-12,2020-02-28,,,http://lims.dccouncil.us/Download/44305/CA23-0444-Introduction.pdf,CA23-0444,Approved,"Proposed Human Care Agreement to exercise Option Year two (2) with Innovative Life Solutions, Inc. ",Deemed Approved,Contract,23,44305,,Contract,2020-03-18,Retained by the Council
Chairman Mendelson,2020-03-12,2020-02-28,,,http://lims.dccouncil.us/Download/44304/CA23-0443-Introduction.pdf,CA23-0443,Approved,"Proposed Human Care Agreement to exercise Option Year two (2) with Wholistic Home & Community Based Services, Inc.",Deemed Approved,Contract,23,44304,,Contract,2020-03-18,Retained by the Council
Chairman Mendelson,2020-03-06,2020-02-24,,,http://lims.dccouncil.us/Download/44229/CA23-0440-Introduction.pdf,CA23-0440,Approved,Proposed contract for Option Period Three (3) with Food and Friends Inc. ,Deemed Approved,Contract,23,44229,,Contract,2020-03-18,Retained by the Council
"Chairman Mendelson and Councilmembers Grosso, R. White, Cheh, Allen, T. White, McDuffie, Bonds, Silverman, Nadeau, Todd, and Gray",,2020-03-17,,R23-0382,http://lims.dccouncil.us/Download/44468/PR23-0772-Introduction.pdf,PR23-0772,,COVID-19 Response Emergency Declaration Resolution of 2020,Approved,Emergency Declaration Resolution,23,44468,,Resolution,2020-03-18,Retained by the Council
"Chairman Mendelson and Councilmembers Grosso, R. White, Cheh, Allen, T. White, McDuffie, Bonds, Silverman, Nadeau, Todd, and Gray",,2020-03-17,,,http://lims.dccouncil.us/Download/44470/B23-0719-Introduction.pdf,B23-0719,,COVID-19 Response Temporary Amendment Act of 2020,New,Temporary Bill,23,44470,,Bill,2020-03-18,Retained by the Council
Councilmember T. White and Chairman Mendelson,,2020-03-12,,,http://lims.dccouncil.us/Download/44449/B23-0714-Introduction.pdf,B23-0714,,Ward 8 Senior Housing Fund Establishment Temporary Amendment Act of 2020,Under Council Review,Temporary Bill,23,44449,,Bill,2020-03-17,Retained by the Council
Councilmember Nadeau,,2020-03-17,,,http://lims.dccouncil.us/Download/44473/B23-0721-Introduction.pdf,B23-0721,,Adams Morgan Business Improvement District Amendment Temporary Amendment Act of 2020,New,Temporary Bill,23,44473,,Bill,2020-03-17,Retained by the Council
Councilmember Nadeau,,2020-03-17,,,http://lims.dccouncil.us/Download/44474/B23-0722-Introduction.pdf,B23-0722,,Department of Human Services Personnel Authority Amendment Act of 2020,New,Permanent Bill,23,44474,,Bill,2020-03-17,Committee on Labor and Workforce Development
Chairman Mendelson,2020-06-24,2020-03-05,,,http://lims.dccouncil.us/Download/44361/PR23-0755-Introduction.pdf,PR23-0755,Disapproved,Alcoholic Beverage Regulations Technical Amendments Approval Resolution of 2020,Under Council Review,Proposed Resolution,23,44361,,Resolution,2020-03-17,Committee on Business and Economic Development
Chairman Mendelson,,2020-03-05,,,http://lims.dccouncil.us/Download/44360/PR23-0754-Introduction.pdf,PR23-0754,,"DC Scholars Public Charter School, Inc. Revenue Bonds Project Approval Resolution of 2020",Under Council Review,Proposed Resolution,23,44360,,Resolution,2020-03-17,Committee on Business and Economic Development
Chairman Mendelson,2020-06-24,2020-03-02,,,http://lims.dccouncil.us/Download/44357/PR23-0752-Introduction.pdf,PR23-0752,Disapproved,Clemency Board Michael Eric Dyson Confirmation Resolution of 2020,Under Council Review,Proposed Resolution,23,44357,,Resolution,2020-03-17,Committee on Judiciary and Public Safety
Chairman Mendelson,,2020-03-05,,,http://lims.dccouncil.us/Download/44362/B23-0706-Introduction.pdf,B23-0706,,District of Champions Extension of Hours Amendment Act of 2020,Under Council Review,Permanent Bill,23,44362,,Bill,2020-03-17,Committee on Business and Economic Development
Chairman Mendelson,2020-03-27,2020-03-16,,,http://lims.dccouncil.us/Download/44466/CA23-0464-Introduction.pdf,CA23-0464,Approved,Proposed contract to exercise Option Period One (1) with ICMA Retirement Corporation ,New,Contract,23,44466,,Contract,2020-03-17,Retained by the Council
Chairman Mendelson,,2020-02-28,,R23-0377,http://lims.dccouncil.us/Download/44297/PR23-0744-Introduction.pdf,PR23-0744,,Ghost Guns Prohibition Emergency Declaration Resolution of 2020,Approved,Emergency Declaration Resolution,23,44297,,Resolution,2020-03-17,Retained by the Council
Councilmembers Allen and Cheh,,2020-03-02,,R23-0372,http://lims.dccouncil.us/Download/44300/PR23-0745-Introduction.pdf,PR23-0745,,Leave to Vote Emergency Declaration Resolution of 2020,Approved,Emergency Declaration Resolution,23,44300,,Resolution,2020-03-17,Retained by the Council
Councilmembers Allen and Nadeau,,2020-03-02,,R23-0371,http://lims.dccouncil.us/Download/44308/PR23-0746-Introduction.pdf,PR23-0746,,Extreme Risk Protection Order Implementation Working Group Emergency Declaration Resolution of 2020,Approved,Emergency Declaration Resolution,23,44308,,Resolution,2020-03-17,Retained by the Council
Councilmember McDuffie,,2020-03-03,,R23-0370,http://lims.dccouncil.us/Download/44311/PR23-0747-Introduction.pdf,PR23-0747,,Deputy Mayor for Planning and Economic Development Limited Grant Making Authority for Check It Enterprises Emergency Declaration Resolution of 2020,Approved,Emergency Declaration Resolution,23,44311,,Resolution,2020-03-17,Retained by the Council
Chairman Mendelson,,2020-02-27,,R23-0369,http://lims.dccouncil.us/Download/44294/PR23-0743-Introduction.pdf,PR23-0743,,Reunion Square Tax Increment Financing Emergency Declaration Resolution of 2019,Approved,Emergency Declaration Resolution,23,44294,,Resolution,2020-03-17,Retained by the Council
Councilmember Bonds,,2020-03-03,,R23-0366,http://lims.dccouncil.us/Download/44313/PR23-0748-Introduction.pdf,PR23-0748,,Reverse Mortgage Insurance and Tax Payment Program Emergency Declaration Resolution of 2020,Approved,Emergency Declaration Resolution,23,44313,,Resolution,2020-03-17,Retained by the Council
Chairman Mendelson,,2020-02-27,,R23-0365,http://lims.dccouncil.us/Download/44252/PR23-0721-Introduction.pdf,PR23-0721,,Substantive Technical Emergency Declaration Resolution of 2020,Approved,Emergency Declaration Resolution,23,44252,,Resolution,2020-03-17,Retained by the Council
Chairman Mendelson,,2020-02-26,,R23-0363,http://lims.dccouncil.us/Download/44288/PR23-0740-Introduction.pdf,PR23-0740,,"Contract No. NFPHCSUPP-20-C-1 Modifications between the Not-for-Profit Hospital Corporation and Morrison Management Specialist, Inc. Approval and Payment Authorization Emergency Declaration Resolution of 2020",Approved,Emergency Declaration Resolution,23,44288,,Resolution,2020-03-17,Retained by the Council
Chairman Mendelson,2020-03-27,2020-03-16,,,http://lims.dccouncil.us/Download/44464/CA23-0463-Introduction.pdf,CA23-0463,Approved,Proposed contract to exercise Option Year Three (3) with Lutheran Social Services of National Capital Area,New,Contract,23,44464,,Contract,2020-03-16,Retained by the Council
Chairman Mendelson,2020-03-27,2020-03-16,,,http://lims.dccouncil.us/Download/44463/CA23-0462-Introduction.pdf,CA23-0462,Approved,"Proposed contract to exercise Option Year Four (4) with Verizon Federal, Inc. ",New,Contract,23,44463,,Contract,2020-03-16,Retained by the Council
Chairman Mendelson,,2020-03-12,,,http://lims.dccouncil.us/Download/44458/PR23-0771-Introduction.pdf,PR23-0771,,Local Rent Supplement Program Contract No. 2019-LRSP-02A Approval Resolution of 2020,Under Council Review,Proposed Resolution,23,44458,,Resolution,2020-03-16,Retained by the Council
Chairman Mendelson,2020-04-29,2020-03-12,,,http://lims.dccouncil.us/Download/44450/CA23-0458-Introduction.pdf,CA23-0458,Disapproved,"Proposed multiyear contract between the District of Columbia Housing Authority (""DCHA"") and ANCHOR PRESERVATION LLC ",Under Council Review,Contract,23,44450,,Contract,2020-03-16,Retained by the Council
Chairman Mendelson,2020-03-30,2020-03-13,,,http://lims.dccouncil.us/Download/44459/GBM23-0068-Introduction.pdf,GBM23-0068,Approved,"FY 2020 Grant Budget Modifications of February 14, 2020",Under Council Review,Grant Budget Modification,23,44459,,Grant Budget Modification,2020-03-16,Retained by the Council
Chairman Mendelson,2020-03-30,2020-03-13,,,http://lims.dccouncil.us/Download/44460/GBM23-0069-Introduction.pdf,GBM23-0069,Approved,"FY 2020 Grant Budget Modifications of February 27, 2020",Under Council Review,Grant Budget Modification,23,44460,,Grant Budget Modification,2020-03-16,Retained by the Council
Chairman Mendelson,2020-03-31,2020-03-16,,,http://lims.dccouncil.us/Download/44462/GBM23-0071-Introduction.pdf,GBM23-0071,Approved,"FY 2020 Grant Budget Modifications of March 10, 2020",New,Grant Budget Modification,23,44462,,Grant Budget Modification,2020-03-16,Retained by the Council
Chairman Mendelson,2020-03-30,2020-03-16,,,http://lims.dccouncil.us/Download/44461/GBM23-0070-Introduction.pdf,GBM23-0070,Approved,"FY 2020 Grant Budget Modifications of March 4, 2020",New,Grant Budget Modification,23,44461,,Grant Budget Modification,2020-03-16,Retained by the Council
Chairman Mendelson,,2020-03-12,,,http://lims.dccouncil.us/Download/44457/B23-0716-Introduction.pdf,B23-0716,,"Contract No. DCAM-19-CS-RFQ-0001P and Modification No. 01 with Soil and Land Use Technology, Inc. Approval and Payment Authorization Emergency Act of 2020",Under Council Review,Emergency Bill,23,44457,,Bill,2020-03-16,Retained by the Council
Chairman Mendelson,,2020-03-12,,,http://lims.dccouncil.us/Download/44456/PR23-0770-Introduction.pdf,PR23-0770,,"Contract No. DCAM-19-CS-RFQ-0001P and Modification No. 01 with Soil and Land Use Technology, Inc. Approval and Payment Authorization Emergency Declaration Resolution of 2020",Under Council Review,Emergency Declaration Resolution,23,44456,,Resolution,2020-03-16,Retained by the Council
Chairman Mendelson,,2020-03-12,,,http://lims.dccouncil.us/Download/44455/B23-0715-Introduction.pdf,B23-0715,,"Contract No. DCAM-19-CS-RFQ-0001W and Modification No. 01 with Capital Construction Group, LLC Approval and Payment Authorization Emergency Act of 2020",Under Council Review,Emergency Bill,23,44455,,Bill,2020-03-16,Retained by the Council
Chairman Mendelson,,2020-03-12,,,http://lims.dccouncil.us/Download/44454/PR23-0769-Introduction.pdf,PR23-0769,,"Contract No. DCAM-19-CS-RFQ-0001W and Modification No. 01 with Capital Construction Group, LLC Approval and Payment Authorization Emergency Declaration Resolution of 2020",Under Council Review,Emergency Declaration Resolution,23,44454,,Resolution,2020-03-16,Retained by the Council
Chairman Mendelson,2020-03-26,2020-03-13,,,http://lims.dccouncil.us/Download/44453/CA23-0461-Introduction.pdf,CA23-0461,Approved,"Proposed Purchase and Sale Agreement by and between the University of the District of Columbia (""University"") and BDC Van Ness, LLC, (Seller) ",Under Council Review,Contract,23,44453,,Contract,2020-03-13,Retained by the Council
Chairman Mendelson,,2020-03-04,,,http://lims.dccouncil.us/Download/44423/ANC23-0060-Introduction.pdf,ANC23-0060,,ANC 3D Resolution to Increase Insurance Limit for Cars and Scooters,Under Council Review,Advisory Neighborhood Commission,23,44423,,Report,2020-03-13,
Chairman Mendelson,2020-03-26,2020-03-13,,,http://lims.dccouncil.us/Download/44451/CA23-0459-Introduction.pdf,CA23-0459,Approved,Proposed contract with KADCON Corporation ,Under Council Review,Contract,23,44451,,Contract,2020-03-13,Retained by the Council
Chairman Mendelson,2020-03-26,2020-03-13,,,http://lims.dccouncil.us/Download/44452/CA23-0460-Introduction.pdf,CA23-0460,Approved,"Proposed contract with City Construction, LLC ",Under Council Review,Contract,23,44452,,Contract,2020-03-13,Retained by the Council
Chairman Mendelson,2020-05-17,2020-03-11,,,,PR23-0767,Approved,Revised ABRA Civil Penalty Schedule Resolution of 2020,Under Council Review,Proposed Resolution,23,44446,,Resolution,2020-03-13,Committee on Business and Economic Development
Chairman Mendelson,,2020-03-10,,,http://lims.dccouncil.us/Download/44445/B23-0712-Introduction.pdf,B23-0712,,"Contract No. DCAM-19-CS-RFQ-0001B and Modification No. 01 with Protec Construction, Inc. Approval and Payment Authorization Emergency Act of 2020",Under Council Review,Emergency Bill,23,44445,,Bill,2020-03-13,Retained by the Council
